{
  "function": "add",
  "source_file": "benchmarks/add.c",
  "rtl_file": "add.v",
  "top_module": {
    "verilog_name": "add",
    "escaped": false
  },
  "contract": {
    "requires": [
      "x >= 0 && y >= 0",
      "x + y <= 2147483647"
    ],
    "ensures": [
      "\\result == x + y"
    ],
    "assigns": [
      "\\nothing"
    ]
  },
  "clock_reset": {
    "clock": "clock",
    "reset": "reset",
    "reset_polarity": "active_low"
  },
  "handshake": {
    "protocol": "start_done",
    "start": "start_port",
    "done": "done_port"
  },
  "timing": {
    "latency_type": "fixed",
    "fixed_cycles": 0,
    "evidence": "controller has a single FSM state (S_0); done_port is driven to 1'b1 combinationally in that same state when start_port==1'b1, with no state transition -- so the result is valid in the same cycle start_port is asserted."
  },
  "parameters": [
    {
      "c_name": "x",
      "c_type": "int",
      "rtl_port": "x",
      "bit_width": 32,
      "signed": true,
      "kind": "scalar"
    },
    {
      "c_name": "y",
      "c_type": "int",
      "rtl_port": "y",
      "bit_width": 32,
      "signed": true,
      "kind": "scalar"
    }
  ],
  "return": {
    "c_type": "int",
    "rtl_port": "return_port",
    "bit_width": 32,
    "signed": true
  },
  "memory": [],
  "provenance": {
    "hls_tool": "Bambu (PandA 2024.10, rev c2ba6936ca2ed63137095fea0b630a1c66e20e63-main)",
    "command": "bambu --top-fname=add benchmarks/add.c",
    "generated_at": "2026-10-05T15:57:26",
    "extraction_method": "automated static parse (metadata_extractor.py) of the top module port list for signal mapping and the controller FSM for latency/handshake; no Bambu scheduling report was available in this environment."
  }
}
